{
  "schema": "fmea-mining.condition-action-damage.v1",
  "version": "1.3.12",
  "status": "conceptual_unvalidated",
  "semantics": {
    "condition": "Estado de fluido, superfície ou desempenho; ocorrência requer medição/observação",
    "action": "Atividade de inspeção, monitoramento ou serviço; executar não prova dano",
    "damage": "Alteração física/funcional de componente; necessita prova independente"
  },
  "safetyInvariant": "condition!=action!=damage",
  "evidenceNature": "no_field_observation",
  "observations": [],
  "workOrderExecutions": [],
  "confirmedComponentDamages": [],
  "conditions": [
    {
      "id": "COND-FUEL-WATER",
      "label": "Água no combustível ou no separador de água",
      "system": "combustivel",
      "medium": "combustivel",
      "observation": "Presença de fase aquosa ou resultado de análise apropriada em amostra representativa",
      "methods": [
        "EV-01",
        "EV-10"
      ],
      "sourceIds": [
        "CAT-FILTERS-FLUIDS-GUIDE",
        "CAT-FUEL-WATER-SEPARATOR-PURPOSE"
      ],
      "limitations": "O indício não prova falha do dreno, do filtro ou do separador, nem determina a origem do ingresso.",
      "status": "condition_hypothesis_not_observed",
      "observedValue": null,
      "observedAt": null
    },
    {
      "id": "COND-FUEL-SEDIMENT",
      "label": "Sedimentos ou partículas no combustível",
      "system": "combustivel",
      "medium": "combustivel",
      "observation": "Resíduo sólido identificado na coleta ou por análise de partículas com método documentado",
      "methods": [
        "EV-01",
        "EV-09"
      ],
      "sourceIds": [
        "CAT-FILTERS-FLUIDS-GUIDE",
        "CAT-FUEL-WATER-SEPARATOR-PURPOSE"
      ],
      "limitations": "Resíduo no reservatório não comprova restrição do elemento filtrante sem inspeção diferencial.",
      "status": "condition_hypothesis_not_observed",
      "observedValue": null,
      "observedAt": null
    },
    {
      "id": "COND-FUEL-FLOW-RESTRICTION",
      "label": "Restrição funcional na alimentação de combustível",
      "system": "combustivel",
      "medium": "combustivel",
      "observation": "Desempenho hidráulico de alimentação divergente de teste aplicável de fluxo ou pressão",
      "methods": [
        "EV-05",
        "EV-12"
      ],
      "sourceIds": [
        "CAT-FILTERS-FLUIDS-GUIDE",
        "ISO-13379-1-2025"
      ],
      "limitations": "Não atribuir obstrução ao filtro apenas por perda de potência, água ou código eletrônico.",
      "status": "condition_hypothesis_not_observed",
      "observedValue": null,
      "observedAt": null
    },
    {
      "id": "COND-COOL-EXTERNAL-DEBRIS",
      "label": "Sujidade ou material entre aletas do radiador",
      "system": "arrefecimento",
      "medium": "ar",
      "observation": "Depósito externo visualmente identificável nas passagens de ar do trocador",
      "methods": [
        "EV-01"
      ],
      "sourceIds": [
        "CAT-RADIATOR-CARE",
        "CAT-FILTERS-FLUIDS-GUIDE"
      ],
      "limitations": "Sujidade externa pode restringir fluxo de ar sem existir dano físico nem obstrução interna.",
      "status": "condition_hypothesis_not_observed",
      "observedValue": null,
      "observedAt": null
    },
    {
      "id": "COND-COOL-INTERNAL-FLOW-RESTRICTION",
      "label": "Restrição interna suspeita à circulação no trocador",
      "system": "arrefecimento",
      "medium": "liquido_arrefecedor",
      "observation": "Indício de resistência interna de circulação que requer teste OEM apropriado",
      "methods": [
        "EV-12",
        "EV-10"
      ],
      "sourceIds": [
        "CAT-RADIATOR-CARE",
        "ISO-13379-1-2025"
      ],
      "limitations": "A presença de fluido degradado ou temperatura alta isoladamente não comprova obstrução interna.",
      "status": "condition_hypothesis_not_observed",
      "observedValue": null,
      "observedAt": null
    },
    {
      "id": "COND-COOL-HIGH-TEMPERATURE",
      "label": "Temperatura do arrefecimento acima do requisito",
      "system": "arrefecimento",
      "medium": "liquido_arrefecedor",
      "observation": "Medição válida e comparável ao requisito OEM em carga/ambiente definidos",
      "methods": [
        "EV-03",
        "EV-14"
      ],
      "sourceIds": [
        "CAT-RADIATOR-CARE",
        "ISO-17359-2018"
      ],
      "limitations": "Sem referência por modelo e condição de operação, não classificar aquecimento como comprovado.",
      "status": "condition_hypothesis_not_observed",
      "observedValue": null,
      "observedAt": null
    },
    {
      "id": "COND-COOL-EXTERNAL-LEAK",
      "label": "Vestígio de perda externa de líquido arrefecedor",
      "system": "arrefecimento",
      "medium": "liquido_arrefecedor",
      "observation": "Trilha ou acúmulo de fluido cuja origem deve ser localizada com segurança",
      "methods": [
        "EV-01",
        "EV-13"
      ],
      "sourceIds": [
        "CAT-RADIATOR-CARE"
      ],
      "limitations": "Não atribuir automaticamente a origem ao radiador; linhas, conexões e outros componentes também podem vazar.",
      "status": "condition_hypothesis_not_observed",
      "observedValue": null,
      "observedAt": null
    },
    {
      "id": "COND-ENGINE-FILTER-DP",
      "label": "Restrição diferencial suspeita no filtro de óleo do motor",
      "system": "motor_diesel",
      "medium": "oleo_motor",
      "observation": "Diferencial de pressão ou indicador do elemento fora da referência para temperatura, rotação e configuração comparáveis",
      "methods": [
        "EV-05",
        "EV-14"
      ],
      "sourceIds": [
        "CAT-ENGINE-OIL-FILTER-SERVICE",
        "CAT-FLUID-ANALYSIS-101"
      ],
      "limitations": "Indicador isolado pode estar incorreto e não comprova por si obstrução física do elemento.",
      "status": "condition_hypothesis_not_observed",
      "observedValue": null,
      "observedAt": null
    },
    {
      "id": "COND-ENGINE-OIL-PARTICLES",
      "label": "Partículas ou resíduos suspeitos no lubrificante do motor",
      "system": "motor_diesel",
      "medium": "oleo_motor",
      "observation": "Resultado representativo de análise do óleo ou resíduo observado no elemento de filtro removido",
      "methods": [
        "EV-08",
        "EV-11"
      ],
      "sourceIds": [
        "CAT-ENGINE-OIL-FILTER-SERVICE",
        "CAT-FLUID-ANALYSIS-101"
      ],
      "limitations": "Partículas não identificam automaticamente rolamento, anel ou bomba de óleo; diferenciar desgaste interno de contaminação introduzida.",
      "status": "condition_hypothesis_not_observed",
      "observedValue": null,
      "observedAt": null
    },
    {
      "id": "COND-ENGINE-LOW-OIL-PRESSURE",
      "label": "Pressão de lubrificação indicada abaixo do requisito",
      "system": "motor_diesel",
      "medium": "oleo_motor",
      "observation": "Indicação e medição independente de pressão sob condição definida e limite OEM aplicável",
      "methods": [
        "EV-05",
        "EV-07"
      ],
      "sourceIds": [
        "CAT-ENGINE-OIL-FILTER-SERVICE",
        "CAT-FLUID-ANALYSIS-101"
      ],
      "limitations": "Pressão baixa pode decorrer de leitura, nível, temperatura, folga ou bomba; não atribuir ao filtro por default.",
      "status": "condition_hypothesis_not_observed",
      "observedValue": null,
      "observedAt": null
    },
    {
      "id": "COND-HYD-OIL-CONTAMINATION",
      "label": "Contaminação por partículas suspeita no óleo hidráulico",
      "system": "hidraulico",
      "medium": "oleo_hidraulico",
      "observation": "Análise de amostra identificada e representativa, considerando limpeza e histórico do sistema",
      "methods": [
        "EV-09",
        "EV-08"
      ],
      "sourceIds": [
        "CAT-HYD-TECHNICAL-ANALYSIS",
        "CAT-HYD-OIL-CLEANLINESS",
        "CAT-HYD-HOSE-INSPECT"
      ],
      "limitations": "Partículas medidas não confirmam automaticamente dano de bomba, válvula ou vedação.",
      "status": "condition_hypothesis_not_observed",
      "observedValue": null,
      "observedAt": null
    },
    {
      "id": "COND-HYD-EXTERNAL-LEAK",
      "label": "Vestígio de óleo hidráulico na região de linha ou bomba",
      "system": "hidraulico",
      "medium": "oleo_hidraulico",
      "observation": "Origem do fluido deve ser localizada após isolamento e procedimentos OEM",
      "methods": [
        "EV-01"
      ],
      "sourceIds": [
        "CAT-HYD-TECHNICAL-ANALYSIS",
        "CAT-HYD-OIL-CLEANLINESS",
        "CAT-HYD-HOSE-INSPECT"
      ],
      "limitations": "Óleo sobre uma bomba pode ter escorrido de mangueira superior; não confirma vedação avariada.",
      "status": "condition_hypothesis_not_observed",
      "observedValue": null,
      "observedAt": null
    },
    {
      "id": "COND-HYD-LOW-FUNCTIONAL-PRESSURE",
      "label": "Desempenho de pressão hidráulica potencialmente insuficiente",
      "system": "hidraulico",
      "medium": "oleo_hidraulico",
      "observation": "Resposta e pressão medidas em ponto autorizado, com temperatura, comando e carga comparáveis",
      "methods": [
        "EV-05",
        "EV-14"
      ],
      "sourceIds": [
        "CAT-HYD-TECHNICAL-ANALYSIS",
        "CAT-HYD-OIL-CLEANLINESS",
        "CAT-HYD-HOSE-INSPECT"
      ],
      "limitations": "Pressão aparente baixa não isola bomba: verificar comando, válvulas, fluxo e instrumento.",
      "status": "condition_hypothesis_not_observed",
      "observedValue": null,
      "observedAt": null
    },
    {
      "id": "COND-HYD-HOSE-COVER-DAMAGE",
      "label": "Abrasão ou fissura aparente na cobertura da mangueira",
      "system": "hidraulico",
      "medium": "mangueira_hidraulica",
      "observation": "Marcas visíveis de contato, fissura ou exposição externa em linha identificada",
      "methods": [
        "EV-01"
      ],
      "sourceIds": [
        "CAT-HYD-HOSE-INSPECT"
      ],